{
  "admission_ready": false,
  "blockers": [
    "admission_not_ready",
    "evaluation_licence_not_ready:contractnli:ValidationError:review or verified terms snapshot is missing",
    "evaluation_licence_not_ready:eventstoryline-v1.5:ValidationError:review or verified terms snapshot is missing",
    "evaluation_licence_not_ready:evidencebench-original-test:ValidationError:review or verified terms snapshot is missing",
    "evaluation_licence_not_ready:hf-logic-owa-v1:ValidationError:review or verified terms snapshot is missing",
    "evaluation_licence_not_ready:hf-process-state-v1:ValidationError:review or verified terms snapshot is missing",
    "evaluation_licence_not_ready:socialiqa-v1.4-validation:ValidationError:review or verified terms snapshot is missing",
    "evaluation_licence_not_ready:vitaminc:ValidationError:review or verified terms snapshot is missing",
    "foundation_bytes_not_ready",
    "licensing_not_ready",
    "public_confirmatory_not_ready",
    "public_evaluation_not_ready:contractnli:ValidationError:evaluation is not sealed and blocker-free",
    "public_evaluation_not_ready:eventstoryline-v1.5:ValidationError:evaluation is not sealed and blocker-free",
    "public_evaluation_not_ready:evidencebench-original-test:ValidationError:evaluation is not sealed and blocker-free",
    "public_evaluation_not_ready:hf-logic-owa-v1:ValidationError:evaluation is not sealed and blocker-free",
    "public_evaluation_not_ready:hf-process-state-v1:ValidationError:evaluation is not sealed and blocker-free",
    "public_evaluation_not_ready:socialiqa-v1.4-validation:ValidationError:evaluation is not sealed and blocker-free",
    "public_evaluation_not_ready:vitaminc:ValidationError:evaluation is not sealed and blocker-free",
    "publisher_checksum_pins_not_verified",
    "quarantine_index_missing",
    "quarantine_not_ready",
    "seal_set_mismatch",
    "source_audit_missing",
    "source_audit_not_ready",
    "source_licence_not_ready:enwiki@20260801:ValidationError:review or verified terms snapshot is missing",
    "source_licence_not_ready:wikidata@20260720-json:ValidationError:review or verified terms snapshot is missing",
    "storage_attestation_missing",
    "structural_inventory_not_ready"
  ],
  "evaluated_at": "2026-08-17T09:40:35Z",
  "evidence": [
    "evaluation_registry:sha256:42cdcae6eb9366ba0b4d020196a47b699831b2072a2522d7b7d05c920d75dc88",
    "phase0_v2_schemas:sha256:81e4ed52680bd1734e8aa5c3988b8000296fc683d46540d3fec5a9c72a0c58bd",
    "source_registry:sha256:4ec850b59b90c189fd68c64868db60834e746b9a2275b692037688be8c72dd3a"
  ],
  "foundation_acquisition_authorized": false,
  "foundation_transform_ready": false,
  "gate_id": "phase0-public-foundation-v2",
  "licensing_ready": false,
  "public_confirmatory_ready": false,
  "quarantine_ready": false,
  "schema_version": "2.0.0",
  "schemas_frozen": true,
  "source_audit_ready": false,
  "storage_identity_ready": false,
  "structural_inventory_ready": false,
  "training_authorized": false
}
